<?xml version="1.0" encoding="UTF-8" ?>
<content-type-mapping
    xmlns="http://github.com/psiphp/content-type/mapping"
    xmlns:xsi="http://www.w3.org/2001/XMLSchema-instance"
    xsi:schemaLocation="http://github.com/psiphp/content-type
    https://github.com/psiphp/content-type/raw/master/schema/mapping.xsd"
    >

    <class
        name="Psi\Component\ContentType\Tests\Unit\Metadata\Driver\Model\Example"
        >

        <field name="fieldOne" type="markdown" role="title" group="group_one">
            <option name="option_one">Foobar</option>
            <option name="option_two">Barfoo</option>
            <option name="option_three" type="collection">
                <option name="sub_one">One</option>
                <option name="sub_two">Two</option>
            </option>
        </field>

        <field name="fieldTwo" type="date">
            <option name="option_one">Foobar</option>
            <option name="option_two">Barfoo</option>
        </field>

    </class>

</content-type-mapping>
